{
  "$schema": "../skill-machine-contract.schema.json",
  "completion_contract": {
    "clauses": [
      {
        "clause_id": "done-01",
        "condition_kind": "success",
        "extraction_status": "classified",
        "requirement": "required",
        "source": {
          "end_char": 53,
          "path": "ad/scale/paid-measurement-loop/SKILL.md",
          "section": "Skill Contract/Done when",
          "sha256": "57720e412d7c037779a964f139bdc531787e44b38694c54c2050e90361eab38b",
          "span_basis": "field-text",
          "start_char": 0
        },
        "text": "the selected change binding is current and non-forked"
      },
      {
        "clause_id": "done-02",
        "condition_kind": "success",
        "extraction_status": "classified",
        "requirement": "required",
        "source": {
          "end_char": 112,
          "path": "ad/scale/paid-measurement-loop/SKILL.md",
          "section": "Skill Contract/Done when",
          "sha256": "57720e412d7c037779a964f139bdc531787e44b38694c54c2050e90361eab38b",
          "span_basis": "field-text",
          "start_char": 55
        },
        "text": "the change exited learning phase before the window opened"
      },
      {
        "clause_id": "done-03",
        "condition_kind": "success",
        "extraction_status": "classified",
        "requirement": "required",
        "source": {
          "end_char": 182,
          "path": "ad/scale/paid-measurement-loop/SKILL.md",
          "section": "Skill Contract/Done when",
          "sha256": "57720e412d7c037779a964f139bdc531787e44b38694c54c2050e90361eab38b",
          "span_basis": "field-text",
          "start_char": 114
        },
        "text": "primary metric is read delta-vs-control over the precommitted window"
      },
      {
        "clause_id": "done-04",
        "condition_kind": "success",
        "extraction_status": "classified",
        "requirement": "required",
        "source": {
          "end_char": 241,
          "path": "ad/scale/paid-measurement-loop/SKILL.md",
          "section": "Skill Contract/Done when",
          "sha256": "57720e412d7c037779a964f139bdc531787e44b38694c54c2050e90361eab38b",
          "span_basis": "field-text",
          "start_char": 184
        },
        "text": "attribution window, currency, and timezone are normalized"
      },
      {
        "clause_id": "done-05",
        "condition_kind": "success",
        "extraction_status": "classified",
        "requirement": "required",
        "source": {
          "end_char": 311,
          "path": "ad/scale/paid-measurement-loop/SKILL.md",
          "section": "Skill Contract/Done when",
          "sha256": "57720e412d7c037779a964f139bdc531787e44b38694c54c2050e90361eab38b",
          "span_basis": "field-text",
          "start_char": 243
        },
        "text": "the result references the matching measurement contract and evidence"
      },
      {
        "clause_id": "done-06",
        "condition_kind": "success",
        "extraction_status": "classified",
        "requirement": "required",
        "source": {
          "end_char": 470,
          "path": "ad/scale/paid-measurement-loop/SKILL.md",
          "section": "Skill Contract/Done when",
          "sha256": "57720e412d7c037779a964f139bdc531787e44b38694c54c2050e90361eab38b",
          "span_basis": "field-text",
          "start_char": 313
        },
        "text": "and `readback_decision` is one of the four. Without a verified platform receipt, execution remains user-reported or recommended rather than being fabricated."
      }
    ],
    "done_when": "the selected change binding is current and non-forked; the change exited learning phase before the window opened; primary metric is read delta-vs-control over the precommitted window; attribution window, currency, and timezone are normalized; the result references the matching measurement contract and evidence; and `readback_decision` is one of the four. Without a verified platform receipt, execution remains user-reported or recommended rather than being fabricated.",
    "extraction_status": "classified",
    "source": {
      "path": "ad/scale/paid-measurement-loop/SKILL.md",
      "section": "Skill Contract/Done when",
      "sha256": "57720e412d7c037779a964f139bdc531787e44b38694c54c2050e90361eab38b"
    }
  },
  "context_hints": {
    "bundle_references": [
      {
        "path": "CONNECTORS.md",
        "reason_code": "authored-reference",
        "requirement": "optional",
        "sha256": "68001b6af3f0fdf15f4110f7db7a09b557c5ffbc35553d59a93e78289f953809",
        "source_line": 30
      },
      {
        "path": "SECURITY.md",
        "reason_code": "authored-reference",
        "requirement": "optional",
        "sha256": "324743c5bf447d990888f816fbe286ac8953d28401f8f02d199ceb08f4852720",
        "source_line": 42
      },
      {
        "path": "ad/orchestrate/ad-test-designer/references/measurement-control.md",
        "reason_code": "authored-reference",
        "requirement": "optional",
        "sha256": "8adc01c733b8e9e3d86e55737edadb4bb8a71d56dae4470f6f7c8249338fcc2c",
        "source_line": 44
      },
      {
        "path": "references/measurement-protocol.md",
        "reason_code": "authored-reference",
        "requirement": "optional",
        "sha256": "968a81503e7e9a3ebd748481daa1143d0d60c975511632dd32a553b2325aa030",
        "source_line": 47
      },
      {
        "path": "references/roas-benchmark.md",
        "reason_code": "authored-reference",
        "requirement": "optional",
        "sha256": "2aef010db6ed59a7163fa07f2acbff00a377638f9e037951cda9ad5ffe097c1a",
        "source_line": 66
      },
      {
        "path": "references/skill-contract.md",
        "reason_code": "authored-reference",
        "requirement": "optional",
        "sha256": "9e6ef5e4e51a46bcb5335d453bf1d448f150a3ac2358554f67dd156eac26b0ff",
        "source_line": 26
      },
      {
        "path": "scripts/connectors/README.md",
        "reason_code": "authored-reference",
        "requirement": "optional",
        "sha256": "755816582373b846b95783c125c6d9cd57d5c20bbf4af97bc00aecdbaa557c56",
        "source_line": 68
      }
    ],
    "project_paths": []
  },
  "contract_id": "skill:paid-measurement-loop",
  "control_requirements": [
    "action-receipt",
    "artifact-binding",
    "cycle-retro",
    "evidence-observation",
    "measurement-contract"
  ],
  "handoff_contract": {
    "extraction_status": "partially-classified",
    "items": [
      {
        "condition": "after the `Unproven` readback and evidence handoff. The auditor is a separate invocation",
        "extraction_status": "partially-classified",
        "item_id": "handoff-01",
        "kind": "unclassified",
        "source": {
          "end_char": 213,
          "path": "ad/scale/paid-measurement-loop/SKILL.md",
          "section": "Next Best Skill",
          "sha256": "57720e412d7c037779a964f139bdc531787e44b38694c54c2050e90361eab38b",
          "span_basis": "field-text",
          "start_char": 0
        },
        "target_skills": [
          "ad-account-auditor"
        ],
        "text": "- **Potential ROAS-R1/R2 evidence** → [ad-account-auditor](../../activate/ad-account-auditor/SKILL.md). Stop this invocation after the `Unproven` readback and evidence handoff. The auditor is a separate invocation"
      },
      {
        "condition": null,
        "extraction_status": "unclassified",
        "item_id": "handoff-02",
        "kind": "unclassified",
        "source": {
          "end_char": 259,
          "path": "ad/scale/paid-measurement-loop/SKILL.md",
          "section": "Next Best Skill",
          "sha256": "57720e412d7c037779a964f139bdc531787e44b38694c54c2050e90361eab38b",
          "span_basis": "field-text",
          "start_char": 215
        },
        "target_skills": [],
        "text": "do not auto-run or simulate its gate result."
      },
      {
        "condition": null,
        "extraction_status": "partially-classified",
        "item_id": "handoff-03",
        "kind": "unclassified",
        "source": {
          "end_char": 455,
          "path": "ad/scale/paid-measurement-loop/SKILL.md",
          "section": "Next Best Skill",
          "sha256": "57720e412d7c037779a964f139bdc531787e44b38694c54c2050e90361eab38b",
          "span_basis": "field-text",
          "start_char": 260
        },
        "target_skills": [
          "report-generator"
        ],
        "text": "- **Trustworthy readback decision** → [report-generator](../../../influencer/report/report-generator/SKILL.md) — fold the decision into a stakeholder report. Do not roll a dirty readback forward."
      },
      {
        "condition": null,
        "extraction_status": "unclassified",
        "item_id": "handoff-04",
        "kind": "unclassified",
        "source": {
          "end_char": 571,
          "path": "ad/scale/paid-measurement-loop/SKILL.md",
          "section": "Next Best Skill",
          "sha256": "57720e412d7c037779a964f139bdc531787e44b38694c54c2050e90361eab38b",
          "span_basis": "field-text",
          "start_char": 457
        },
        "target_skills": [],
        "text": "Visited-set and `max-depth: 3` termination rules apply per [Skill Contract](../../../references/skill-contract.md)"
      },
      {
        "condition": "if the next target was already run this chain, STOP and report chain-complete.",
        "extraction_status": "unclassified",
        "item_id": "handoff-05",
        "kind": "unclassified",
        "source": {
          "end_char": 651,
          "path": "ad/scale/paid-measurement-loop/SKILL.md",
          "section": "Next Best Skill",
          "sha256": "57720e412d7c037779a964f139bdc531787e44b38694c54c2050e90361eab38b",
          "span_basis": "field-text",
          "start_char": 573
        },
        "target_skills": [],
        "text": "if the next target was already run this chain, STOP and report chain-complete."
      }
    ],